{
  "chapters": [
    {
      "id": "00",
      "lessons": [
        {
          "hand_ids": [],
          "id": "00-01",
          "path": "docs/en/00-orientation/how-to-use-this-repo.md",
          "prereq": [],
          "quiz_ids": [],
          "scenario": [
            "shared"
          ],
          "slug": "how-to-use-this-repo",
          "spot_ids": [],
          "status": "ready",
          "table_ids": [],
          "title": {
            "en": "How to use this curriculum: hole cards, board, the four streets and position names",
            "zh": "怎么读这套教材：底牌、牌面、四条街与位置名称"
          },
          "unverified_count": 0
        },
        {
          "hand_ids": [],
          "id": "00-02",
          "path": "docs/en/00-orientation/derivation-over-memory.md",
          "prereq": [
            "00-01"
          ],
          "quiz_ids": [],
          "scenario": [
            "shared"
          ],
          "slug": "derivation-over-memory",
          "spot_ids": [],
          "status": "ready",
          "table_ids": [],
          "title": {
            "en": "Derivation before memory: every number must be recomputable by the engine",
            "zh": "先推导再记忆：一个数字必须能被引擎重算出来"
          },
          "unverified_count": 0
        },
        {
          "hand_ids": [],
          "id": "00-03",
          "path": "docs/en/00-orientation/setup-and-toolchain.md",
          "prereq": [
            "00-01",
            "00-02"
          ],
          "quiz_ids": [],
          "scenario": [
            "shared"
          ],
          "slug": "setup-and-toolchain",
          "spot_ids": [],
          "status": "ready",
          "table_ids": [],
          "title": {
            "en": "Set up the toolchain: the CLI, random seeds and deterministic output",
            "zh": "装好工具链：命令行、随机种子与确定性输出"
          },
          "unverified_count": 0
        }
      ],
      "scenario": [
        "shared",
        "shared",
        "shared"
      ],
      "slug": "00-orientation",
      "summary": {
        "en": "How the repository is read: vocabulary, the fixed lesson template, provenance, and why numbers are generated rather than typed.",
        "zh": "先讲清这套教材怎么用：术语、结构、来源标注，以及为什么数字必须由引擎生成。"
      },
      "title": {
        "en": "Orientation",
        "zh": "导论"
      }
    },
    {
      "id": "01",
      "lessons": [
        {
          "hand_ids": [],
          "id": "01-01",
          "path": "docs/en/01-combinatorics-equity/combos-from-1326-to-169.md",
          "prereq": [
            "00-01",
            "00-02"
          ],
          "quiz_ids": [],
          "scenario": [
            "shared"
          ],
          "slug": "combos-from-1326-to-169",
          "spot_ids": [],
          "status": "ready",
          "table_ids": [],
          "title": {
            "en": "From hole combos to hand classes: how many combos each class really has",
            "zh": "从起手组合到手牌类别：每一类到底有几个组合"
          },
          "unverified_count": 0
        },
        {
          "hand_ids": [],
          "id": "01-02",
          "path": "docs/en/01-combinatorics-equity/blockers-and-card-removal.md",
          "prereq": [
            "01-01"
          ],
          "quiz_ids": [],
          "scenario": [
            "shared"
          ],
          "slug": "blockers-and-card-removal",
          "spot_ids": [],
          "status": "ready",
          "table_ids": [],
          "title": {
            "en": "Blockers and removal effects: how one card rewrites the opponent's combo count",
            "zh": "阻断牌与移除效应：一张牌如何改掉对手的组合计数"
          },
          "unverified_count": 0
        },
        {
          "hand_ids": [],
          "id": "01-03",
          "path": "docs/en/01-combinatorics-equity/exact-equity-by-enumeration.md",
          "prereq": [
            "01-01",
            "01-02"
          ],
          "quiz_ids": [],
          "scenario": [
            "shared"
          ],
          "slug": "exact-equity-by-enumeration",
          "spot_ids": [],
          "status": "ready",
          "table_ids": [],
          "title": {
            "en": "Exact equity by enumeration: turning outs into per-street probabilities",
            "zh": "穷举胜率：把补牌数换成每一街的精确概率"
          },
          "unverified_count": 0
        },
        {
          "hand_ids": [],
          "id": "01-04",
          "path": "docs/en/01-combinatorics-equity/monte-carlo-variance-and-seeds.md",
          "prereq": [
            "01-03",
            "00-03"
          ],
          "quiz_ids": [],
          "scenario": [
            "shared"
          ],
          "slug": "monte-carlo-variance-and-seeds",
          "spot_ids": [],
          "status": "ready",
          "table_ids": [],
          "title": {
            "en": "Monte Carlo error: variance, standard error and pinned seeds",
            "zh": "模拟误差从哪来：方差、标准误与固定种子"
          },
          "unverified_count": 0
        },
        {
          "hand_ids": [],
          "id": "01-05",
          "path": "docs/en/01-combinatorics-equity/the-seven-card-evaluator.md",
          "prereq": [
            "01-01"
          ],
          "quiz_ids": [],
          "scenario": [
            "shared"
          ],
          "slug": "the-seven-card-evaluator",
          "spot_ids": [],
          "status": "ready",
          "table_ids": [],
          "title": {
            "en": "The seven-card evaluator: hand classification and kicker tie-breaks",
            "zh": "七张牌评估器：牌型归类与踢脚判定的边界情形"
          },
          "unverified_count": 0
        },
        {
          "hand_ids": [],
          "id": "01-06",
          "path": "docs/en/01-combinatorics-equity/equity-realization-vs-raw-equity.md",
          "prereq": [
            "01-03",
            "01-05"
          ],
          "quiz_ids": [],
          "scenario": [
            "shared"
          ],
          "slug": "equity-realization-vs-raw-equity",
          "spot_ids": [],
          "status": "ready",
          "table_ids": [],
          "title": {
            "en": "Equity is not money: why realization falls short of raw equity",
            "zh": "胜率不等于拿到手的钱：胜率实现为何低于名义胜率"
          },
          "unverified_count": 0
        },
        {
          "hand_ids": [],
          "id": "01-07",
          "path": "docs/en/01-combinatorics-equity/reading-a-13x13-grid.md",
          "prereq": [
            "01-01",
            "01-02"
          ],
          "quiz_ids": [],
          "scenario": [
            "shared"
          ],
          "slug": "reading-a-13x13-grid",
          "spot_ids": [],
          "status": "ready",
          "table_ids": [],
          "title": {
            "en": "Reading a 13x13 grid: what a cell counts and what the axes mean",
            "zh": "读 13×13 网格：一格代表几个组合、行列轴是什么"
          },
          "unverified_count": 0
        }
      ],
      "scenario": [
        "shared",
        "shared",
        "shared",
        "shared",
        "shared",
        "shared",
        "shared"
      ],
      "slug": "01-combinatorics-equity",
      "summary": {
        "en": "Reduce a hand to countable objects: combos, removal effects, exact equity, simulation error and hand evaluation.",
        "zh": "把牌局还原成可数的对象：组合、移除效应、精确胜率、模拟误差与牌力评估。"
      },
      "title": {
        "en": "Combinatorics and Equity",
        "zh": "组合数学与胜率"
      }
    },
    {
      "id": "02",
      "lessons": [
        {
          "hand_ids": [],
          "id": "02-01",
          "path": "docs/en/02-the-math-of-one-decision/break-even-percentage.md",
          "prereq": [
            "00-02",
            "01-07"
          ],
          "quiz_ids": [],
          "scenario": [
            "shared"
          ],
          "slug": "break-even-percentage",
          "spot_ids": [],
          "status": "ready",
          "table_ids": [],
          "title": {
            "en": "Break-even percentage: the risk a call takes against the reward it buys",
            "zh": "保本百分比：一次跟注承担的风险对应多少回报"
          },
          "unverified_count": 0
        },
        {
          "hand_ids": [],
          "id": "02-02",
          "path": "docs/en/02-the-math-of-one-decision/pot-odds-to-call-frequency.md",
          "prereq": [
            "02-01",
            "01-06"
          ],
          "quiz_ids": [],
          "scenario": [
            "shared"
          ],
          "slug": "pot-odds-to-call-frequency",
          "spot_ids": [],
          "status": "ready",
          "table_ids": [],
          "title": {
            "en": "Pot odds into a call: required equity and where implied odds break the shortcut",
            "zh": "底池赔率翻译成跟注：所需胜率与隐含赔率的适用边界"
          },
          "unverified_count": 0
        },
        {
          "hand_ids": [],
          "id": "02-03",
          "path": "docs/en/02-the-math-of-one-decision/deriving-minimum-defense-frequency.md",
          "prereq": [
            "02-01",
            "02-02"
          ],
          "quiz_ids": [],
          "scenario": [
            "shared"
          ],
          "slug": "deriving-minimum-defense-frequency",
          "spot_ids": [],
          "status": "ready",
          "table_ids": [],
          "title": {
            "en": "Minimum defense frequency: why pot/(pot+bet)",
            "zh": "最低防守频率：为什么是 pot/(pot+bet)"
          },
          "unverified_count": 0
        },
        {
          "hand_ids": [],
          "id": "02-04",
          "path": "docs/en/02-the-math-of-one-decision/bluff-to-value-ratio.md",
          "prereq": [
            "02-01",
            "02-03"
          ],
          "quiz_ids": [],
          "scenario": [
            "shared"
          ],
          "slug": "bluff-to-value-ratio",
          "spot_ids": [],
          "status": "ready",
          "table_ids": [],
          "title": {
            "en": "The bluff-to-value ratio: how indifference sets the mix",
            "zh": "诈唬与价值的配比：无差别条件如何定出比例"
          },
          "unverified_count": 0
        },
        {
          "hand_ids": [],
          "id": "02-05",